### ISSUE TITLE
Avoid internet traffic from tests

### ISSUE THREAD

**Issue by vasild** [bitcoin/bitcoin#31339]
### Is there an existing issue for this?

- [X] I have searched the existing issues

### Current behaviour

Tests should not try to open connections to the internet because:

* they may succeed or fail unpredictably, depending on external environment
* are slow
* dox the developer to their ISP that they are running Bitcoin Core tests

### Expected behaviour

Tests should only open local connections (e.g. on the `lo` interface).

Enforce this in the CI, having it to detect non-local traffic and fail accordingly.

### Steps to reproduce

Run the functional tests and monitor the traffic.

### How did you obtain Bitcoin Core

Compiled from source

### What version of Bitcoin Core are you using?

master@22ef95dbe3e467039e6cd18988e66557d94041d1

### Operating system and version

Ubuntu 28.04 LTS

**Comment by l0rinc** [comment]
Having no fully end-to-end tests sounds a bit dangerous, since it's part of the fundamental behavior of Bitcoin, not sure we should completely mock that away (i.e. certain bugs could creep in that work locally only - no idea how that would be possible, but that's exactly the point).

**Comment by vasild** [comment]
@l0rinc the current end to end tests do communicate locally via the `lo` interface.

@fanquake Honestly, I forgot which test was that. During latest coredev I investigated that briefly with @maflcko or @0xB10C (?) and we observed the non local traffic with `tcpdump(1)`. Now, my point is to enforce this in the CI, even if such test does not exist currently - has been fixed since coredev or my investigation back then was wrong.

**Comment by jonatack** [comment]
> Enforce this in the CI, having it to detect non-local traffic and fail accordingly.

Concept ACK

**Comment by mzumsande** [comment]
> Honestly, I forgot which test was that.

Maybe it was https://github.com/bitcoin/bitcoin/pull/29605#discussion_r1701616675 (I independently ran into that a few weeks ago and included a fix in #31142)

**Comment by vasild** [comment]
@theStack, yes, it was that one, to `11.22.33.44`, thanks!

Lets keep the focus here on enforcing this in the CI, rather than individual tests that do that.

I couldn't find the output of `iptables -j LOG` in the CI - it is nowhere to be found in `/var/log` nor in `dmesg` output even though `iptables -v -x -n -L` shows some packets matched. Any help would be welcome!

Using `tcpdump(1)` is another approach that got me further: https://github.com/bitcoin/bitcoin/pull/31349 and it detects indeed some interesting stuff:

```
2024-11-22T13:18:59.9043792Z 13:13:38.030342 IP 172.18.0.2.58228 > 11.22.33.44.18444: Flags [S], seq 3319460523, win 64240, options [mss 1460,sackOK,TS val 1156831752 ecr 0,nop,wscale 7], length 0
2024-11-22T13:18:59.9044913Z 13:13:42.540986 IP 11.22.33.44.18444 > 172.18.0.2.58224: Flags [R.], seq 684480607, ack 0, win 0, length 0
```

`11.22.33.44` even responds to the test! And some more interesting stuff:

```
2024-11-22T13:18:59.9052028Z 13:17:56.527339 IP 172.18.0.2.59916 > 0.0.0.1.18444: Flags [S], seq 2190025647, win 64240, options [mss 1460,sackOK,TS val 4215569398 ecr 0,nop,wscale 7], length 0
2024-11-22T13:18:59.9081176Z 13:18:17.646343 IP 172.18.0.2.45242 > 0.0.0.2.18444: Flags [S], seq 2461798101, win 64240, options [mss 1460,sackOK,TS val 274989920 ecr 0,nop,wscale 7], length 0
2024-11-22T13:18:59.9083474Z 13:18:18.286342 IP 172.18.0.2.47882 > 1.2.3.4.9050: Flags [S], seq 377974635, win 64240, options [mss 1460,sackOK,TS val 1999254858 ecr 0,nop,wscale 7], length 0
2024-11-22T13:18:59.9084632Z 13:18:18.472934 IP 1.2.3.4.9050 > 172.18.0.2.47876: Flags [R.], seq 319153034, ack 0, win 0, length 0
```


(full log at https://github.com/vasild/bitcoin/actions/runs/11972758832/job/33380324078?pr=4)

**Comment by 0xB10C** [comment]
Did you consider running the docker container in CI with `--network none`? 

https://docs.docker.com/engine/network/drivers/none/

**Comment by vasild** [comment]
@0xB10C my wish is to catch and report these, not just block them silently (only) from the CI environments.
