### ISSUE TITLE
Java Authenticator broken for 0.12 RPC server on Linux

### ISSUE THREAD

**Issue by jlopp** [bitcoin/bitcoin#7462]
I'm in the process of testing 0.12 in our dev environment for one of our java-based services. This service makes RPC requests to bitcoind, but when I upgrade from 0.11 to 0.12 every request now gets a 401 "unauthorized" response.

The RPC server is clearly still functional because I can query it manually via cURL. However, breaking Java's Authenticator may be problematic - it is the recommended way to authenticate according to the wiki: https://en.bitcoin.it/wiki/API_reference_(JSON-RPC)

One strange thing to note is that usage of Java Authenticator still works on OS X with Core 0.12. This appears to be a platform-specific issue. I'm not sure about Windows.

I was able to implement a workaround by setting the authentication in the HTTP request manually as shown in http://www.avajava.com/tutorials/lessons/how-do-i-connect-to-a-url-using-basic-authentication.html

**Comment by sdaftuar** [comment]
I'm just guessing here, but if this is related to RPC over SSL, then I think support for that was dropped in 0.12, see #5677. (No idea why this wouldn't affect OS X as well though, so maybe this is a bad guess.)

Only other thing I can think of is if this is somehow related to the new cookie file stuff, which would allow you to start up bitcoind without an rpcuser/password in the config (a departure from older versions), though in that case I'd expect curl to not work either unless you were using the credentials from the .cookie file.

**Comment by jlopp** [comment]
It's definitely not SSL - never used SSL for RPC. Both of the bitcoind instances I'm testing on have an rpcuser and password set, so it shouldn't be using the cookie.

**Comment by laanwj** [comment]
To diagnose it would be useful to have an intercept using tcpdump/wireshark of the HTTP session.

**Comment by jlopp** [comment]
I'm not familiar with the tools so let me know if I need to change anything to get better info. Here's the output I get when running 0.12rc2:
```
sudo tcpdump -A -l -v -i lo port 18332
tcpdump: listening on lo, link-type EN10MB (Ethernet), capture size 65535 bytes

19:26:15.614096 IP (tos 0x0, ttl 64, id 41711, offset 0, flags [DF], proto TCP (6), length 60)
    localhost.56923 > localhost.18332: Flags [S], cksum 0xfe30 (incorrect -> 0xc210), seq 1924882815, win 43690, options [mss 65495,sackOK,TS val 626770832 ecr 0,nop,wscale 7], length 0
E..<..@.@............[G.r.a..........0.........
%[..........
19:26:15.614105 IP (tos 0x0, ttl 64, id 0, offset 0, flags [DF], proto TCP (6), length 60)
    localhost.18332 > localhost.56923: Flags [S.], cksum 0xfe30 (incorrect -> 0x9cda), seq 561846972, ack 1924882816, win 43690, options [mss 65495,sackOK,TS val 626770832 ecr 626770832,nop,wscale 7], length 0
E..<..@.@.<.........G..[!}..r.a......0.........
%[..%[......
19:26:15.614115 IP (tos 0x0, ttl 64, id 41712, offset 0, flags [DF], proto TCP (6), length 52)
    localhost.56923 > localhost.18332: Flags [.], cksum 0xfe28 (incorrect -> 0x6f1f), ack 1, win 342, options [nop,nop,TS val 626770832 ecr 626770832], length 0
E..4..@.@............[G.r.a.!}.....V.(.....
%[..%[..
19:26:15.615091 IP (tos 0x0, ttl 64, id 45114, offset 0, flags [DF], proto TCP (6), length 60)
    localhost.56924 > localhost.18332: Flags [S], cksum 0xfe30 (incorrect -> 0x488c), seq 3658707882, win 43690, options [mss 65495,sackOK,TS val 626770832 ecr 0,nop,wscale 7], length 0
E..<.:@.@............\G...s..........0.........
%[..........
19:26:15.615104 IP (tos 0x0, ttl 64, id 0, offset 0, flags [DF], proto TCP (6), length 60)
    localhost.18332 > localhost.56924: Flags [S.], cksum 0xfe30 (incorrect -> 0x89b6), seq 341819769, ack 3658707883, win 43690, options [mss 65495,sackOK,TS val 626770832 ecr 626770832,nop,wscale 7], length 0
E..<..@.@.<.........G..\._.y..s......0.........
%[..%[......
19:26:15.615118 IP (tos 0x0, ttl 64, id 45115, offset 0, flags [DF], proto TCP (6), length 52)
    localhost.56924 > localhost.18332: Flags [.], cksum 0xfe28 (incorrect -> 0x5bfb), ack 1, win 342, options [nop,nop,TS val 626770832 ecr 626770832], length 0
E..4.;@.@............\G...s.._.z...V.(.....
%[..%[..
19:26:15.615855 IP (tos 0x0, ttl 64, id 41713, offset 0, flags [DF], proto TCP (6), length 284)
    localhost.56923 > localhost.18332: Flags [P.], cksum 0xff10 (incorrect -> 0x726b), seq 1:233, ack 1, win 342, options [nop,nop,TS val 626770833 ecr 626770832], length 232
E.....@.@............[G.r.a.!}.....V.......
%[..%[..POST / HTTP/1.1
Content-Type: application/json-rpc
Cache-Control: no-cache, no-store
Accept: application/json-rpc
Pragma: no-cache
User-Agent: Java/1.8.0_72
Host: 127.0.0.1:18332
Connection: keep-alive
Content-Length: 34


19:26:15.615877 IP (tos 0x0, ttl 64, id 55597, offset 0, flags [DF], proto TCP (6), length 52)
    localhost.18332 > localhost.56923: Flags [.], cksum 0xfe28 (incorrect -> 0x6e2d), ack 233, win 350, options [nop,nop,TS val 626770833 ecr 626770833], length 0
E..4.-@.@.c.........G..[!}..r.bh...^.(.....
%[..%[..
19:26:15.615877 IP (tos 0x0, ttl 64, id 45116, offset 0, flags [DF], proto TCP (6), length 284)
    localhost.56924 > localhost.18332: Flags [P.], cksum 0xff10 (incorrect -> 0x5e46), seq 1:233, ack 1, win 342, options [nop,nop,TS val 626770833 ecr 626770832], length 232
E....<@.@............\G...s.._.z...V.......
%[..%[..POST / HTTP/1.1
Content-Type: application/json-rpc
Cache-Control: no-cache, no-store
Accept: application/json-rpc
Pragma: no-cache
User-Agent: Java/1.8.0_72
Host: 127.0.0.1:18332
Connection: keep-alive
Content-Length: 45


19:26:15.615888 IP (tos 0x0, ttl 64, id 746, offset 0, flags [DF], proto TCP (6), length 52)
    localhost.18332 > localhost.56924: Flags [.], cksum 0xfe28 (incorrect -> 0x5b09), ack 233, win 350, options [nop,nop,TS val 626770833 ecr 626770833], length 0
E..4..@.@.9.........G..\._.z..t....^.(.....
%[..%[..
19:26:15.615893 IP (tos 0x0, ttl 64, id 41714, offset 0, flags [DF], proto TCP (6), length 86)
    localhost.56923 > localhost.18332: Flags [P.], cksum 0xfe4a (incorrect -> 0xc331), seq 233:267, ack 1, win 342, options [nop,nop,TS val 626770833 ecr 626770833], length 34
E..V..@.@............[G.r.bh!}.....V.J.....
%[..%[..{"method":"getrawmempool","id":""}
19:26:15.615898 IP (tos 0x0, ttl 64, id 55598, offset 0, flags [DF], proto TCP (6), length 52)
    localhost.18332 > localhost.56923: Flags [.], cksum 0xfe28 (incorrect -> 0x6e0b), ack 267, win 350, options [nop,nop,TS val 626770833 ecr 626770833], length 0
E..4..@.@.c.........G..[!}..r.b....^.(.....
%[..%[..
19:26:15.615900 IP (tos 0x0, ttl 64, id 45117, offset 0, flags [DF], proto TCP (6), length 97)
    localhost.56924 > localhost.18332: Flags [P.], cksum 0xfe55 (incorrect -> 0xfa94), seq 233:278, ack 1, win 342, options [nop,nop,TS val 626770833 ecr 626770833], length 45
E..a.=@.@..W.........\G...t.._.z...V.U.....
%[..%[..{"method":"estimatefee","id":"","params":[1]}
19:26:15.615907 IP (tos 0x0, ttl 64, id 747, offset 0, flags [DF], proto TCP (6), length 52)
    localhost.18332 > localhost.56924: Flags [.], cksum 0xfe28 (incorrect -> 0x5adc), ack 278, win 350, options [nop,nop,TS val 626770833 ecr 626770833], length 0
E..4..@.@.9.........G..\._.z..t....^.(.....
%[..%[..
19:26:15.616042 IP (tos 0x0, ttl 64, id 748, offset 0, flags [DF], proto TCP (6), length 182)
    localhost.18332 > localhost.56924: Flags [P.], cksum 0xfeaa (incorrect -> 0xb073), seq 1:131, ack 278, win 350, options [nop,nop,TS val 626770833 ecr 626770833], length 130
E.....@.@.9T........G..\._.z..t....^.......
%[..%[..HTTP/1.1 401 Unauthorized
Date: Thu, 04 Feb 2016 19:26:15 GMT
Content-Length: 0
Content-Type: text/html; charset=ISO-8859-1


19:26:15.616056 IP (tos 0x0, ttl 64, id 45118, offset 0, flags [DF], proto TCP (6), length 52)
    localhost.56924 > localhost.18332: Flags [.], cksum 0xfe28 (incorrect -> 0x5a5a), ack 131, win 350, options [nop,nop,TS val 626770833 ecr 626770833], length 0
E..4.>@.@............\G...t.._.....^.(.....
%[..%[..
19:26:15.616082 IP (tos 0x0, ttl 64, id 55599, offset 0, flags [DF], proto TCP (6), length 182)
    localhost.18332 > localhost.56923: Flags [P.], cksum 0xfeaa (incorrect -> 0xc3a2), seq 1:131, ack 267, win 350, options [nop,nop,TS val 626770833 ecr 626770833], length 130
E..../@.@.c.........G..[!}..r.b....^.......
%[..%[..HTTP/1.1 401 Unauthorized
Date: Thu, 04 Feb 2016 19:26:15 GMT
Content-Length: 0
Content-Type: text/html; charset=ISO-8859-1

19:26:15.616090 IP (tos 0x0, ttl 64, id 41715, offset 0, flags [DF], proto TCP (6), length 52)
    localhost.56923 > localhost.18332: Flags [.], cksum 0xfe28 (incorrect -> 0x6d89), ack 131, win 350, options [nop,nop,TS val 626770833 ecr 626770833], length 0
E..4..@.@............[G.r.b.!}.?...^.(.....
%[..%[..

```

On the other hand, here's the output I see when I run my service against 0.11.2:
```
sudo tcpdump -A -l -v -i lo port 18332
sudo: unable to resolve host indexerdev03
tcpdump: listening on lo, link-type EN10MB (Ethernet), capture size 65535 bytes

19:31:40.204545 IP (tos 0x0, ttl 64, id 7224, offset 0, flags [DF], proto TCP (6), length 60)
    localhost.56960 > localhost.18332: Flags [S], cksum 0xfe30 (incorrect -> 0xff81), seq 1022565556, win 43690, options [mss 65495,sackOK,TS val 626851980 ecr 0,nop,wscale 7], length 0
E..<.8@.@. ...........G.<............0.........
%]..........
19:31:40.204554 IP (tos 0x0, ttl 64, id 0, offset 0, flags [DF], proto TCP (6), length 60)
    localhost.18332 > localhost.56960: Flags [S.], cksum 0xfe30 (incorrect -> 0x6673), seq 1736117145, ack 1022565557, win 43690, options [mss 65495,sackOK,TS val 626851980 ecr 626851980,nop,wscale 7], length 0
E..<..@.@.<.........G...g{..<........0.........
%]..%]......
19:31:40.204565 IP (tos 0x0, ttl 64, id 7225, offset 0, flags [DF], proto TCP (6), length 52)
    localhost.56960 > localhost.18332: Flags [.], cksum 0xfe28 (incorrect -> 0x38b8), ack 1, win 342, options [nop,nop,TS val 626851980 ecr 626851980], length 0
E..4.9@.@. ...........G.<...g{.....V.(.....
%]..%]..
19:31:40.206717 IP (tos 0x0, ttl 64, id 7226, offset 0, flags [DF], proto TCP (6), length 284)
    localhost.56960 > localhost.18332: Flags [P.], cksum 0xff10 (incorrect -> 0x3b04), seq 1:233, ack 1, win 342, options [nop,nop,TS val 626851980 ecr 626851980], length 232
E....:@.@.............G.<...g{.....V.......
%]..%]..POST / HTTP/1.1
Content-Type: application/json-rpc
Cache-Control: no-cache, no-store
Accept: application/json-rpc
Pragma: no-cache
User-Agent: Java/1.8.0_72
Host: 127.0.0.1:18332
Connection: keep-alive
Content-Length: 45


19:31:40.206757 IP (tos 0x0, ttl 64, id 2838, offset 0, flags [DF], proto TCP (6), length 52)
    localhost.18332 > localhost.56960: Flags [.], cksum 0xfe28 (incorrect -> 0x37c8), ack 233, win 350, options [nop,nop,TS val 626851980 ecr 626851980], length 0
E..4..@.@.1.........G...g{..<......^.(.....
%]..%]..
19:31:40.206761 IP (tos 0x0, ttl 64, id 7227, offset 0, flags [DF], proto TCP (6), length 97)
    localhost.56960 > localhost.18332: Flags [P.], cksum 0xfe55 (incorrect -> 0xd753), seq 233:278, ack 1, win 342, options [nop,nop,TS val 626851980 ecr 626851980], length 45
E..a.;@.@. Z..........G.<...g{.....V.U.....
%]..%]..{"method":"estimatefee","id":"","params":[1]}
19:31:40.206768 IP (tos 0x0, ttl 64, id 2839, offset 0, flags [DF], proto TCP (6), length 52)
    localhost.18332 > localhost.56960: Flags [.], cksum 0xfe28 (incorrect -> 0x379b), ack 278, win 350, options [nop,nop,TS val 626851980 ecr 626851980], length 0
E..4..@.@.1.........G...g{..<......^.(.....
%]..%]..
19:31:40.206868 IP (tos 0x0, ttl 64, id 2840, offset 0, flags [DF], proto TCP (6), length 547)
    localhost.18332 > localhost.56960: Flags [P.], cksum 0x0018 (incorrect -> 0x0c98), seq 1:496, ack 278, win 350, options [nop,nop,TS val 626851980 ecr 626851980], length 495
E..#..@.@./.........G...g{..<......^.......
%]..%]..HTTP/1.0 401 Authorization Required
Date: Thu, 04 Feb 2016 19:31:40 +0000
Server: bitcoin-json-rpc/v0.11.2
WWW-Authenticate: Basic realm="jsonrpc"
Content-Type: text/html
Content-Length: 296

<!DOCTYPE HTML PUBLIC "-//W3C//DTD HTML 4.01 Transitional//EN"
"http://www.w3.org/TR/1999/REC-html401-19991224/loose.dtd">
<HTML>
<HEAD>
<TITLE>Error</TITLE>
<META HTTP-EQUIV='Content-Type' CONTENT='text/html; charset=ISO-8859-1'>
</HEAD>
<BODY><H1>401 Unauthorized.</H1></BODY>
</HTML>

19:31:40.206875 IP (tos 0x0, ttl 64, id 7228, offset 0, flags [DF], proto TCP (6), length 52)
    localhost.56960 > localhost.18332: Flags [.], cksum 0xfe28 (incorrect -> 0x35ac), ack 496, win 350, options [nop,nop,TS val 626851980 ecr 626851980], length 0
....^.(...............G.<...g{
%]..%]..
19:31:40.206915 IP (tos 0x0, ttl 64, id 2841, offset 0, flags [DF], proto TCP (6), length 52)
    localhost.18332 > localhost.56960: Flags [F.], cksum 0xfe28 (incorrect -> 0x35ab), seq 496, ack 278, win 350, options [nop,nop,TS val 626851980 ecr 626851980], length 0
.<......^.(.........G...g{
%]..%]..
19:31:40.209986 IP (tos 0x0, ttl 64, id 7229, offset 0, flags [DF], proto TCP (6), length 52)
    localhost.56960 > localhost.18332: Flags [F.], cksum 0xfe28 (incorrect -> 0x35a9), seq 278, ack 497, win 350, options [nop,nop,TS val 626851981 ecr 626851980], length 0
....^.(...............G.<...g{
%]..%]..
19:31:40.210001 IP (tos 0x0, ttl 64, id 2842, offset 0, flags [DF], proto TCP (6), length 52)
    localhost.18332 > localhost.56960: Flags [.], cksum 0xfe28 (incorrect -> 0x35a8), ack 279, win 350, options [nop,nop,TS val 626851981 ecr 626851981], length 0
.<......^.(.........G...g{
%]..%]..
19:31:40.210346 IP (tos 0x0, ttl 64, id 40283, offset 0, flags [DF], proto TCP (6), length 60)
    localhost.56961 > localhost.18332: Flags [S], cksum 0xfe30 (incorrect -> 0x0c2a), seq 2938543574, win 43690, options [mss 65495,sackOK,TS val 626851981 ecr 0,nop,wscale 7], length 0
E..<.[@.@..^..........G..&...........0.........
%]..........
19:31:40.210354 IP (tos 0x0, ttl 64, id 0, offset 0, flags [DF], proto TCP (6), length 60)
    localhost.18332 > localhost.56961: Flags [S.], cksum 0xfe30 (incorrect -> 0x1573), seq 111069725, ack 2938543575, win 43690, options [mss 65495,sackOK,TS val 626851981 ecr 626851981,nop,wscale 7], length 0
E..<..@.@.<.........G........&.......0.........
%]..%]......
19:31:40.210364 IP (tos 0x0, ttl 64, id 40284, offset 0, flags [DF], proto TCP (6), length 52)
    localhost.56961 > localhost.18332: Flags [.], cksum 0xfe28 (incorrect -> 0xe7b7), ack 1, win 342, options [nop,nop,TS val 626851981 ecr 626851981], length 0
E..4.\@.@..e..........G..&.........V.(.....
%]..%]..
19:31:40.210566 IP (tos 0x0, ttl 64, id 40285, offset 0, flags [DF], proto TCP (6), length 327)
    localhost.56961 > localhost.18332: Flags [P.], cksum 0xff3b (incorrect -> 0x6742), seq 1:276, ack 1, win 342, options [nop,nop,TS val 626851981 ecr 626851981], length 275
E..G.]@.@..Q..........G..&.........V.;.....
%]..%]..POST / HTTP/1.1
Content-Type: application/json-rpc
Cache-Control: no-cache, no-store
Accept: application/json-rpc
Pragma: no-cache
User-Agent: Java/1.8.0_72
Host: 127.0.0.1:18332
Connection: keep-alive
Content-Length: 45
Authorization: Basic Yml0Y29pbnJwYzphc2Rm


19:31:40.210594 IP (tos 0x0, ttl 64, id 51859, offset 0, flags [DF], proto TCP (6), length 52)
    localhost.18332 > localhost.56961: Flags [.], cksum 0xfe28 (incorrect -> 0xe69c), ack 276, win 350, options [nop,nop,TS val 626851981 ecr 626851981], length 0
E..4..@.@.r.........G........&.....^.(.....
%]..%]..
19:31:40.210600 IP (tos 0x0, ttl 64, id 40286, offset 0, flags [DF], proto TCP (6), length 97)
    localhost.56961 > localhost.18332: Flags [P.], cksum 0xfe55 (incorrect -> 0x8628), seq 276:321, ack 1, win 342, options [nop,nop,TS val 626851981 ecr 626851981], length 45
E..a.^@.@..6..........G..&.........V.U.....
%]..%]..{"method":"estimatefee","id":"","params":[1]}
19:31:40.210607 IP (tos 0x0, ttl 64, id 51860, offset 0, flags [DF], proto TCP (6), length 52)
    localhost.18332 > localhost.56961: Flags [.], cksum 0xfe28 (incorrect -> 0xe66f), ack 321, win 350, options [nop,nop,TS val 626851981 ecr 626851981], length 0
E..4..@.@.r-........G........&.....^.(.....
%]..%]..
19:31:40.210753 IP (tos 0x0, ttl 64, id 51861, offset 0, flags [DF], proto TCP (6), length 264)
    localhost.18332 > localhost.56961: Flags [P.], cksum 0xfefc (incorrect -> 0x0148), seq 1:213, ack 321, win 350, options [nop,nop,TS val 626851981 ecr 626851981], length 212
E.....@.@.qX........G........&.....^.......
%]..%]..HTTP/1.1 200 OK
Date: Thu, 04 Feb 2016 19:31:40 +0000
Connection: keep-alive
Content-Length: 44
Content-Type: application/json
Server: bitcoin-json-rpc/v0.11.2

{"result":-1.00000000,"error":null,"id":""}

19:31:40.210760 IP (tos 0x0, ttl 64, id 40287, offset 0, flags [DF], proto TCP (6), length 52)
    localhost.56961 > localhost.18332: Flags [.], cksum 0xfe28 (incorrect -> 0xe59b), ack 213, win 350, options [nop,nop,TS val 626851981 ecr 626851981], length 0
E..4._@.@..b..........G..&.........^.(.....
%]..%]..
19:31:40.231422 IP (tos 0x0, ttl 64, id 40288, offset 0, flags [DF], proto TCP (6), length 327)
    localhost.56961 > localhost.18332: Flags [P.], cksum 0xff3b (incorrect -> 0x86fe), seq 321:596, ack 213, win 350, options [nop,nop,TS val 626851987 ecr 626851981], length 275
E..G.`@.@..N..........G..&.........^.;.....
%]..%]..POST / HTTP/1.1
Content-Type: application/json-rpc
Cache-Control: no-cache, no-store
Accept: application/json-rpc
Pragma: no-cache
User-Agent: Java/1.8.0_72
Host: 127.0.0.1:18332
Connection: keep-alive
Authorization: Basic Yml0Y29pbnJwYzphc2Rm
Content-Length: 45


19:31:40.231455 IP (tos 0x0, ttl 64, id 40289, offset 0, flags [DF], proto TCP (6), length 97)
    localhost.56961 > localhost.18332: Flags [P.], cksum 0xfe55 (incorrect -> 0x8306), seq 596:641, ack 213, win 350, options [nop,nop,TS val 626851987 ecr 626851981], length 45
E..a.a@.@..3..........G..&.*.......^.U.....
%]..%]..{"method":"estimatefee","id":"","params":[2]}
19:31:40.231502 IP (tos 0x0, ttl 64, id 51862, offset 0, flags [DF], proto TCP (6), length 52)
    localhost.18332 > localhost.56961: Flags [.], cksum 0xfe28 (incorrect -> 0xe446), ack 641, win 359, options [nop,nop,TS val 626851987 ecr 626851987], length 0
E..4..@.@.r+........G........&.W...g.(.....
%]..%]..
19:31:40.231624 IP (tos 0x0, ttl 64, id 51863, offset 0, flags [DF], proto TCP (6), length 263)
    localhost.18332 > localhost.56961: Flags [P.], cksum 0xfefb (incorrect -> 0xf940), seq 213:424, ack 641, win 359, options [nop,nop,TS val 626851987 ecr 626851987], length 211
E.....@.@.qW........G........&.W...g.......
%]..%]..HTTP/1.1 200 OK
Date: Thu, 04 Feb 2016 19:31:40 +0000
Connection: keep-alive
Content-Length: 43
Content-Type: application/json
Server: bitcoin-json-rpc/v0.11.2

{"result":0.00022187,"error":null,"id":""}
```

So, offhand there is a clear difference in the response from bitcoind; it seems to be no longer returning the HTML even though it's still setting the Content-Type as text/html. I'm not completely sure that this is what causes Java's Authenticator class to break, but it sounds like a distinct possibility. It /appears/ that the way Java's Authenticator class works is that it makes an initial unauthenticated request, then upon parsing a 401 response it sets the Authorization header on future requests.

**Comment by laanwj** [comment]
I think this is the key `WWW-Authenticate: Basic realm="jsonrpc"`. No such header in the new response.

**Comment by laanwj** [comment]
@jlopp Can you test if  #7472 solves your problem?

**Comment by jlopp** [comment]
:+1: Confirmed fixed; thanks!
